{
  "note": "Advisory control crosswalk — a defensible STARTING POINT mapping commitwork's baseline checks to control frameworks (EU CRA Annex I Part II, SOC 2 Trust Services Criteria, NIST SP 800-53 Rev 5). It is NOT a substitute for your assessor's/QSA's control mapping; review before relying on it in an audit. SCOPE HONESTY: commitwork evidences only the TECHNICAL subset a code/dependency/runtime/SBOM scanner can prove — see each framework's `scope`/`catalog`. The organizational majority (governance, HR, physical, contingency, policy) is out of scope and must be evidenced elsewhere (GRC, e.g. Vanta/Drata). A check is 'evidenced' when it PROVABLY RAN on a product repo, by either signal: `category` (rollup repo.scanners.<category>.ran) OR the precise per-check status in the sweep's checks-status.json (pass|fail = ran; skip = requirements unmet, e.g. a runtime scanner with no live URL). Evidence sources beyond checks (ledger, annotations, the monitoring program itself, audit records, KEV/EPSS enrichment) also evidence controls. explicit uncertainty.",
  "frameworks": {
    "cra": {
      "name": "EU CRA Annex I Part II",
      "scope": "The 8 essential vulnerability-handling requirements — all within reach of a code/SBOM/monitoring tool.",
      "catalog": 8,
      "items": {
        "1": "Identify & document vulnerabilities and components (incl. SBOM)",
        "2": "Address & remediate vulnerabilities without delay",
        "3": "Apply effective & regular tests and reviews",
        "4": "Publish information about fixed vulnerabilities",
        "5": "Coordinated vulnerability disclosure policy",
        "6": "Facilitate vulnerability reports (contact/process)",
        "7": "Secure distribution of updates",
        "8": "Timely, free security updates"
      }
    },
    "soc2": {
      "name": "SOC 2 Trust Services Criteria (2017, rev. points of focus 2022)",
      "scope": "commitwork evidences the technical subset of System Operations (CC7) and Change Management (CC8), plus a few Logical Access (CC6) criteria. CC1–CC5, CC9 and most of CC6 are ORGANIZATIONAL (control environment, risk assessment, HR, physical) and out of scope — evidence them in your GRC platform. All 33 common criteria are listed so an export can name the ones no check or evidence source supplies; those are reported as not evidenced, never as met.",
      "commonCriteria": 33,
      "catalogSource": "https://www.aicpa-cima.com/resources/download/2017-trust-services-criteria-with-revised-points-of-focus-2022",
      "controls": {
        "CC1.1": "Commitment to integrity and ethical values",
        "CC1.2": "Board independence and oversight of internal control",
        "CC1.3": "Structures, reporting lines, authorities and responsibilities",
        "CC1.4": "Commitment to competence",
        "CC1.5": "Accountability for internal control responsibilities",
        "CC2.1": "Relevant, quality information to support internal control",
        "CC2.2": "Internal communication of objectives and responsibilities",
        "CC2.3": "Communication with external parties",
        "CC3.1": "Objectives specified clearly enough to identify risks",
        "CC3.2": "Risk identification and analysis",
        "CC3.3": "Fraud risk assessment",
        "CC3.4": "Assessment of changes that could impact internal control",
        "CC4.1": "Ongoing and separate evaluations of internal control",
        "CC4.2": "Evaluation and communication of control deficiencies",
        "CC5.1": "Control activities that mitigate risks",
        "CC5.2": "General control activities over technology",
        "CC5.3": "Control activities deployed through policies and procedures",
        "CC6.1": "Logical access security",
        "CC6.2": "User registration, authorization and removal",
        "CC6.3": "Role-based access authorization",
        "CC6.4": "Physical access restriction",
        "CC6.5": "Asset disposal and data recovery protections",
        "CC6.6": "Protection against threats from outside system boundaries",
        "CC6.7": "Restrict transmission / encryption in transit",
        "CC6.8": "Prevent or detect unauthorized or malicious software",
        "CC7.1": "Detect configuration changes & vulnerabilities",
        "CC7.2": "Monitor for anomalies & security events",
        "CC7.3": "Evaluate security events to determine whether they are incidents",
        "CC7.4": "Respond to identified security incidents",
        "CC7.5": "Recover from identified security incidents",
        "CC8.1": "Change management (authorize, design, test, approve)",
        "CC9.1": "Risk mitigation for business disruption",
        "CC9.2": "Vendor and business partner risk management"
      }
    },
    "nist80053": {
      "name": "NIST SP 800-53 Rev 5",
      "scope": "commitwork maps the code/dependency/runtime/SBOM-evidenceable controls only. A FedRAMP Moderate baseline is ~323 controls and the full catalog ~1000; the rest (PE physical, PS personnel, CP contingency, AT training, PL/PM planning, MP media, MA maintenance) are organizational/operational and out of scope.",
      "catalog": 1007,
      "baselineModerate": 323,
      "controls": {
        "AC-3": "Access Enforcement",
        "AU-3": "Content of Audit Records",
        "AU-12": "Audit Record Generation",
        "CA-5": "Plan of Action and Milestones",
        "CA-7": "Continuous Monitoring",
        "CM-2": "Baseline Configuration",
        "CM-3": "Configuration Change Control",
        "CM-6": "Configuration Settings",
        "CM-8": "System Component Inventory",
        "IA-5": "Authenticator Management",
        "RA-3": "Risk Assessment",
        "RA-5": "Vulnerability Monitoring and Scanning",
        "SA-11": "Developer Testing and Evaluation",
        "SA-15": "Development Process, Standards, and Tools",
        "SC-8": "Transmission Confidentiality and Integrity",
        "SC-13": "Cryptographic Protection",
        "SI-2": "Flaw Remediation",
        "SI-3": "Malicious Code Protection",
        "SI-4": "System Monitoring",
        "SR-3": "Supply Chain Controls and Processes",
        "SR-4": "Provenance"
      }
    }
  },
  "checks": {
    "secrets":                       { "category": "secrets",     "nist80053": ["IA-5", "SA-11"], "soc2": ["CC7.1"], "cra": ["1", "3"] },
    "secrets-gitleaks":              { "category": "secrets",     "nist80053": ["IA-5", "SA-11"], "soc2": ["CC7.1"], "cra": ["1", "3"] },
    "sast":                          { "category": "sastSemgrep", "nist80053": ["SA-11", "SA-15"], "soc2": ["CC7.1", "CC8.1"], "cra": ["3"] },
    "sast-codeql":                   { "category": null,          "nist80053": ["SA-11", "SA-15"], "soc2": ["CC7.1", "CC8.1"], "cra": ["3"] },
    "sast-codeql-java":              { "category": null,          "nist80053": ["SA-11", "SA-15"], "soc2": ["CC7.1", "CC8.1"], "cra": ["3"] },
    "sast-codeql-python":            { "category": null,          "nist80053": ["SA-11", "SA-15"], "soc2": ["CC7.1", "CC8.1"], "cra": ["3"] },
    "sast-codeql-ruby":              { "category": null,          "nist80053": ["SA-11", "SA-15"], "soc2": ["CC7.1", "CC8.1"], "cra": ["3"] },
    "sast-codeql-cpp":               { "category": null,          "nist80053": ["SA-11", "SA-15"], "soc2": ["CC7.1", "CC8.1"], "cra": ["3"] },
    "sast-codeql-swift":             { "category": null,          "nist80053": ["SA-11", "SA-15"], "soc2": ["CC7.1", "CC8.1"], "cra": ["3"] },
    "sast-codeql-csharp":            { "category": null,          "nist80053": ["SA-11", "SA-15"], "soc2": ["CC7.1", "CC8.1"], "cra": ["3"] },
    "sast-codeql-rust":              { "category": null,          "nist80053": ["SA-11", "SA-15"], "soc2": ["CC7.1", "CC8.1"], "cra": ["3"] },
    "sast-codeql-go":                { "category": null,          "nist80053": ["SA-11", "SA-15"], "soc2": ["CC7.1", "CC8.1"], "cra": ["3"] },
    "deps-rust-audit":               { "category": null,          "nist80053": ["RA-5", "SR-3"], "soc2": ["CC7.1"], "cra": ["1", "2"] },
    "jackson-caseinsensitive-guard": { "category": null,          "nist80053": ["SA-11"], "soc2": ["CC7.1"], "cra": ["3"] },
    "deps-osv":                      { "category": "maliciousPackages", "nist80053": ["RA-5", "SR-3", "SI-3"], "soc2": ["CC7.1"], "cra": ["1", "2"] },
    "deps-jvm":                      { "category": "depsJvm",     "nist80053": ["RA-5", "SR-3"], "soc2": ["CC7.1"], "cra": ["1", "2"] },
    "deps-retire":                   { "category": "supplyChain", "nist80053": ["RA-5", "SR-3"], "soc2": ["CC7.1"], "cra": ["1", "2"] },
    "npm-audit":                     { "category": "supplyChain", "nist80053": ["RA-5", "SR-3"], "soc2": ["CC7.1"], "cra": ["1", "2"] },
    "supply-chain-socket":           { "category": "supplyChain", "nist80053": ["SR-3", "SR-4", "SI-3"], "soc2": ["CC7.1"], "cra": ["1", "3"] },
    "supply-chain-guarddog":         { "category": "supplyChainHeuristic", "nist80053": ["SR-3", "SR-4"], "soc2": ["CC7.1"], "cra": ["1", "3"] },
    "iac-config":                    { "category": "iac",         "nist80053": ["CM-6", "CM-2"], "soc2": ["CC7.1"], "cra": ["3"] },
    "dockerfile-lint":               { "category": "iac",         "nist80053": ["CM-6", "CM-2"], "soc2": ["CC7.1"], "cra": ["3"] },
    "sbom":                          { "category": null,          "nist80053": ["SR-4", "CM-8"], "soc2": ["CC7.1"], "cra": ["1"] },
    "sbom-syft":                     { "category": null,          "nist80053": ["SR-4", "CM-8"], "soc2": ["CC7.1"], "cra": ["1"] },
    "authz-test":                    { "category": null,          "nist80053": ["AC-3"], "soc2": ["CC6.3"], "cra": ["3"] },
    "dast-nuclei":                   { "category": null,          "nist80053": ["RA-5"], "soc2": ["CC7.1"], "cra": ["3"] },
    "dast-authz-bola":               { "category": null,          "nist80053": ["AC-3"], "soc2": ["CC6.3"], "cra": ["3"] },